{"schemaVersion":1,"id":"gimp","name":"GIMP","category":"art","platforms":["windows","macos","linux"],"executables":["gimp-2.10.exe","gimp.exe","gimp"],"knownPaths":["C:/Program Files/GIMP 2/bin/gimp-2.10.exe","/Applications/GIMP*.app"],"fileTypes":[".xcf"],"launchTemplates":[{"id":"open","name":"Open","arguments":[]}]}
