{"schemaVersion":1,"id":"photoshop","name":"Adobe Photoshop","category":"art","platforms":["windows","macos"],"executables":["Photoshop.exe"],"knownPaths":["C:/Program Files/Adobe/Adobe Photoshop */Photoshop.exe","/Applications/Adobe Photoshop*/Adobe Photoshop*.app"],"macBundleIds":["com.adobe.Photoshop"],"fileTypes":[".psd",".psb"],"launchTemplates":[{"id":"open","name":"Open","arguments":[]}]}
