{"schemaVersion":1,"id":"nuke","name":"Foundry Nuke","category":"dcc","platforms":["windows","macos","linux"],"executables":["Nuke.exe"],"knownPaths":["C:/Program Files/Nuke*/Nuke*.exe","/Applications/Nuke*/Nuke*.app","/usr/local/Nuke*/Nuke*"],"fileTypes":[".nk"],"launchTemplates":[{"id":"open","name":"Open","arguments":[]}]}
