{"schemaVersion":1,"id":"wwise","name":"Audiokinetic Wwise","category":"utility","platforms":["windows","macos"],"executables":["Wwise.exe"],"knownPaths":["C:/Program Files (x86)/Audiokinetic/Wwise*/Authoring/x64/Release/bin/Wwise.exe","C:/Program Files/Audiokinetic/Wwise*/Authoring/x64/Release/bin/Wwise.exe"],"fileTypes":[".wproj"],"launchTemplates":[{"id":"open","name":"Open","arguments":[]}]}
