{"schemaVersion":1,"id":"lightcraft","name":"LightCraft","category":"art","platforms":["windows","macos","linux"],"executables":["LightCraft.exe","lightcraft.exe","LightCraft","lightcraft"],"knownPaths":["C:/Program Files/LightCraft/LightCraft.exe","C:/Program Files/ArtCraft/LightCraft/LightCraft.exe","/home/{user}/.local/share/artcraft/lightcraft/lightcraft","/Applications/LightCraft.app","/Applications/ArtCraft/LightCraft.app"],"launchTemplates":[{"id":"open","name":"Open","arguments":[]}]}
