{"schemaVersion":1,"id":"premiere-pro","name":"Adobe Premiere Pro","category":"dcc","platforms":["windows","macos"],"executables":["Adobe Premiere Pro.exe"],"knownPaths":["C:/Program Files/Adobe/Adobe Premiere Pro */Adobe Premiere Pro.exe","/Applications/Adobe Premiere Pro*/Adobe Premiere Pro*.app"],"macBundleIds":["com.adobe.PremierePro"],"fileTypes":[".prproj"],"launchTemplates":[{"id":"open","name":"Open","arguments":[]}]}
