{"schemaVersion":1,"id":"unreal-engine","name":"Unreal Engine","category":"game-engine","platforms":["windows","macos","linux"],"executables":["UnrealEditor.exe","UnrealEditor"],"knownPaths":["C:/Program Files/Epic Games/UE_*/Engine/Binaries/Win64/UnrealEditor.exe","/Users/Shared/Epic Games/UE_*/Engine/Binaries/Mac/UnrealEditor.app"],"macBundleIds":["com.epicgames.UnrealEditor"],"fileTypes":[".uproject"],"launchTemplates":[{"id":"editor","name":"Unreal Editor","arguments":["{projectFile}"]}]}
