{"schemaVersion":1,"id":"substance-painter","name":"Substance 3D Painter","category":"art","platforms":["windows","macos","linux"],"executables":["Adobe Substance 3D Painter.exe","Substance Painter.exe"],"knownPaths":["C:/Program Files/Adobe/Adobe Substance 3D Painter/Adobe Substance 3D Painter.exe","/Applications/Adobe Substance 3D Painter*/Adobe Substance 3D Painter*.app","/Applications/Adobe Substance 3D Painter.app"],"fileTypes":[".spp"],"launchTemplates":[{"id":"open","name":"Open","arguments":[]}]}
