{"schemaVersion":1,"id":"aseprite","name":"Aseprite","category":"art","platforms":["windows","macos","linux"],"executables":["Aseprite.exe","aseprite.exe","aseprite"],"knownPaths":["C:/Program Files/Aseprite/Aseprite.exe","C:/Program Files (x86)/Steam/steamapps/common/Aseprite/Aseprite.exe","/Applications/Aseprite.app","/Users/{user}/Library/Application Support/Steam/steamapps/common/Aseprite/Aseprite.app"],"fileTypes":[".ase",".aseprite"],"launchTemplates":[{"id":"open","name":"Open","arguments":[]}]}
