{"schemaVersion":1,"id":"anicraft","name":"AniCraft","category":"dcc","platforms":["windows","macos","linux"],"executables":["AniCraft.exe","anicraft.exe","AniCraft","anicraft"],"knownPaths":["C:/Program Files/AniCraft/AniCraft.exe","C:/Program Files/ArtCraft/AniCraft/AniCraft.exe","/home/{user}/.local/share/artcraft/anicraft/anicraft","/Applications/AniCraft.app","/Applications/ArtCraft/AniCraft.app"],"launchTemplates":[{"id":"open","name":"Open","arguments":[]}]}
