{"schemaVersion":1,"id":"illustrator","name":"Adobe Illustrator","category":"art","platforms":["windows","macos"],"executables":["Illustrator.exe"],"knownPaths":["C:/Program Files/Adobe/Adobe Illustrator */Support Files/Contents/Windows/Illustrator.exe","/Applications/Adobe Illustrator*/Adobe Illustrator*.app"],"macBundleIds":["com.adobe.illustrator"],"fileTypes":[".ai"],"launchTemplates":[{"id":"open","name":"Open","arguments":[]}]}
