{"schemaVersion":1,"id":"substance-designer","name":"Substance 3D Designer","category":"art","platforms":["windows","macos","linux"],"executables":["Adobe Substance 3D Designer.exe","Substance Designer.exe"],"knownPaths":["C:/Program Files/Adobe/Adobe Substance 3D Designer/Adobe Substance 3D Designer.exe","/Applications/Adobe Substance 3D Designer*/Adobe Substance 3D Designer*.app","/Applications/Adobe Substance 3D Designer.app"],"fileTypes":[".sbs"],"launchTemplates":[{"id":"open","name":"Open","arguments":[]}]}
