{"schemaVersion":1,"id":"affinity-photo","name":"Affinity Photo","category":"art","platforms":["windows","macos"],"executables":["Photo.exe"],"knownPaths":["C:/Program Files/Affinity/Photo */Photo.exe","/Applications/Affinity Photo*.app"],"fileTypes":[".afphoto"],"launchTemplates":[{"id":"open","name":"Open","arguments":[]}]}
